A1: Athlon interface method dispatch cost 2002-01-10 Yesterday, I examined the cost of virtual method dispatch (VMD) vs. interface method dispatch (IMD). I did my investigations on my Thinkpad T-23, which uses a Pentium III-M processor. Today, I am curious about the effects of CPU architecture on the relative cost of VMD vs. IMD. While I was investigating these effects, I encountered a number of Heisenberg effects that caused me to spend some performing control experiments so that I could actually determine what it was that I was looking at. I have a large number of different CPU's running in various computers around my house. I have a Pentium 166 MMX, a Pentium Pro 150, a Pentium 233 MMX, a dual Celeron 400, a Celeron 600, a Pentium III-M 1.13GHz, an Athlon 1200, and a Pentium 4 1.6GHz. Eventually, I might decide to examine the progress that Intel has made with respect to hiding indirection costs, but for the time being, I decided to look at the differences between my 1.13GHz Pentium III-M and my Athlon 1200. Since I am now comparing results between different computers, I needed to update my benchmark software so that it would report results in seconds, instead of ticks of the high-resolution CPU counter. Here is what the test rig looks like in its current form: const int MAX_COUNT = 100000000; static long _performanceFrequency; static double TimeVirtualMethodDispatch( C c ) { long vmdStart, vmdEnd; QueryPerformanceCounter( out vmdStart ); for( int i = 0; i < MAX_COUNT; i++ ) c.M1(); QueryPerformanceCounter( out vmdEnd ); return ((double)(vmdEnd - vmdStart)) / _performanceFrequency; } static double TimeInterfaceMethodDispatch( I1 i1 ) { long imdStart, imdEnd; QueryPerformanceCounter( out imdStart ); for( int i = 0; i < MAX_COUNT; i++ ) i1.M1(); QueryPerformanceCounter( out imdEnd ); return ((double)(imdEnd - imdStart)) / _performanceFrequency; } static void Main(string[] args) { C c = new C(); I1 i1 = (I1)c; QueryPerformanceFrequency( out _performanceFrequency ); // Force JIT-compilation TimeVirtualMethodDispatch( c ); TimeInterfaceMethodDispatch( i1 ); // Calls to output results omitted for clarity} To jog your memory, these are the x86 instruction sequences for: Virtual Method Dispatch: 0440 mov ecx,edi ;esi contains objref0442 mov eax,[ecx] ;get method table0444 call dword ptr [eax+0x38] ;invoke via slot in MT Interface Method Dispatch: 04af mov ecx,edi ;edi contains objref04b1 mov eax,[ecx] ;get method table04b3 mov eax,[eax+0xc] ;get global IT04b6 mov eax,[eax+0x2c] ;get local IT04b9 call dword ptr [eax] ;invoke via slot in IT Recall that we are attempting to measure the cost of the two additional levels of indirection introduced by the interface method dispatch mechanism used by the CLR. Here are the raw benchmark results: The Pentium III-M executes the IMD instruction sequence only 12.5% slower than the VMD instruction sequence. The Athlon 1200, on the other hand, executes the IMD instruction sequence 30% slower than the VMD instruction sequence. The key observation here is that the Pentium III-M totally kicks the Athlon 1200's ass in hiding the cost of the indirection used by IMD! The take-home message here is that your mileage will vary significantly if your code is executed on different platforms. However, keep in mind the following: This is a totally contrived benchmark; we are measuring the ping cost of invoking methods via VMD and IMD. These are relative numbers, we are still invoking a method 100,000,000 times in well under a second. Expressed differently, the Pentium III-M is dispatching 159 million VMD calls per second and the Athlon 1200 is dispatching 164 million VMD calls per second! It would be interesting to see whether the x86 instruction sequence for IMD could be optimized specifically for Athlon processors to try and narrow the performance gap. postCount('Weblog/fog0000000057.html'); | B1: About me About this site My plan My other life My products My publications April 2003 March 2003 February 2003 January 2003 December 2002 November 2002 October 2002 September 2002 August 2002 July 2002 June 2002 May 2002 April 2002 March 2002 February 2002 January 2002 December 2001 - Book suggestions - Interface dispatch vs. object reference dispatch - x86 Resources - Entertainment PC's Part 2 - Entertainment PC's - Hello CppUnit Don Box Richard Caetano Peter Drayton Jeroen Frijters Sam Gentile Scott Hanselman Drew Marsh Ingo Rammer Tomas Restrepo Chris Sells Joel Spolsky Clemens Vasters Jason Whittington Brad Wilson

A1: Athlon 1200 Results -- Release build
A3: Run | B3: VMD | C3: IMD | D3: %Diff
A4: 1 | B4: 0.610 | C4: 0.870 | D4: =(C4-B4)/C4 -> 0.2988505747126437
A5: 2 | B5: 0.61299999999999999 | C5: 0.86899999999999999 | D5: =(C5-B5)/C5 -> 0.29459148446490219
A6: 3 | B6: 0.60799999999999998 | C6: 0.877 | D6: =(C6-B6)/C6 -> 0.30672748004561007
A7: 4 | B7: 0.61099999999999999 | C7: 0.86799999999999999 | D7: =(C7-B7)/C7 -> 0.29608294930875578
A8: 5 | B8: 0.60699999999999998 | C8: 0.86899999999999999 | D8: =(C8-B8)/C8 -> 0.30149597238204834
A10: Avg | B10: =AVERAGE(B4:B8) -> 0.60980000000000012 | C10: =AVERAGE(C4:C8) -> 0.87059999999999993 | D10: =AVERAGE(D4:D8) -> 0.29954969218279198
A11: +/- | B11: =STDEV(B4:B8) -> 2.387467277227238E-3 | C11: =STDEV(C4:C8) -> 3.6469165057612537E-3 | D11: =STDEV(D4:D8) -> 4.8062339826313964E-3
A13: Pentium III-M Results -- Release build
A15: Run | B15: VMD | C15: IMD | D15: %Diff
A16: 1 | B16: 0.629 | C16: 0.71499999999999997 | D16: =(C16-B16)/C16 -> 0.12027972027972024
A17: 2 | B17: 0.623 | C17: 0.71499999999999997 | D17: =(C17-B17)/C17 -> 0.12867132867132863
A18: 3 | B18: 0.63100000000000001 | C18: 0.72299999999999998 | D18: =(C18-B18)/C18 -> 0.12724757952973717
A19: 4 | B19: 0.629 | C19: 0.71899999999999997 | D19: =(C19-B19)/C19 -> 0.12517385257301805
A20: 5 | B20: 0.63100000000000001 | C20: 0.71899999999999997 | D20: =(C20-B20)/C20 -> 0.12239221140472875
A22: Avg | B22: =AVERAGE(B16:B20) -> 0.62859999999999994 | C22: =AVERAGE(C16:C20) -> 0.71819999999999995 | D22: =AVERAGE(D16:D20) -> 0.12475293849170657
A23: +/- | B23: =STDEV(B16:B20) -> 3.286335345044464E-3 | C23: =STDEV(C16:C20) -> 3.346640106134658E-3 | D23: =STDEV(D16:D20) -> 3.440090759103382E-3